{
    "enabled": true,
    "max_time_steps": 10,
    "default_step_size": 1.0,
    "use_painleve_filter": false,
    "severity_cap": 1.0,
    "planes": {
        "3": {
            "enabled": true
        },
        "6": {
            "enabled": true
        },
        "9": {
            "enabled": true
        }
    },
    "drift_parameters_ref": "schema/tw369/drift_parameters.json",
    "notes": "Default TW369 engine configuration with all planes enabled and standard parameters."
}